{
  "$schema": "../schema/plugin-manifest.schema.json",
  "schemaVersion": "1",
  "id": "beat-lyric-cuts",
  "name": "Beat Lyric Cuts",
  "summary": "Beat-synced lyric sections, cover slices and kinetic typography for the DancingMusic stage.",
  "version": "1.0.0",
  "publisher": { "name": "DancingMusic", "url": "https://github.com/DancingMusic" },
  "repository": "https://github.com/DancingMusic/DancePlugin-BeatLyricCuts",
  "license": { "name": "GPL-3.0-only", "url": "https://github.com/DancingMusic/DancePlugin-BeatLyricCuts/blob/main/LICENSE", "commercialUse": true },
  "compatibility": { "protocolPackage": "@dancingmusic/plugin-sdk", "protocolVersion": "^1.1.0" },
  "distribution": {
    "url": "https://github.com/DancingMusic/DancePlugin-BeatLyricCuts/releases/download/v1.0.0/index.js",
    "format": "esm",
    "integrity": "sha256-zvlzhu2+PuBQMonXBZteGjh+3lqMdnJ84QiIZKDgOoM="
  },
  "releaseNotesUrl": "https://github.com/DancingMusic/DancePlugin-BeatLyricCuts/releases/tag/v1.0.0",
  "publishedAt": "2026-07-12T01:40:00Z",
  "capabilities": ["audio-reactive", "cover-art", "lyrics"],
  "permissions": [],
  "tags": ["lyrics", "kinetic-typography", "beat-sync"],
  "status": "published",
  "submittedAt": "2026-07-12T01:40:00Z",
  "updatedAt": "2026-07-12T01:40:00Z"
}
